id,title,brief,url,img_src,message145,迷彩洗礼青春 雨中检阅铮铮铁骨,只有刻苦磨砺，才能百炼成钢；只有经历风雨，才能顶天立地。,https://military.cctv.com/2021/06/25/ARTI8taPiXgiXSoGSKH3QyBJ210625.shtml,https://p2.img.cctvpic.com/photoworkspace/2021/06/25/2021062516380235216.jpg,烟雨朦胧，雾霭沉沉，白雾似白纱笼罩着群山，往日热闹的村落一片沉寂。此时，战略支援某部新兵团，却是另一番景象。震天的呼号声中，急骤的雨滴中，低洼的泥道里，湿漉的训练场上，近600名新兵帅气亮相分列式、刺杀操、战斗演练……经过近3个月的入伍训练，新兵们系统接受了队列、战术、轻武器操作、战场救护、野外生存等课目训练，逐步打牢了军事素质基础，顺利实现了从地方青年向合格军人的转变。挺拔的军姿、嘹亮的口号、坚毅的眼神，全面彰显着他们作为一名中国军人的荣誉和自豪。“分列式，开始！”随着指挥员一声令下，由数百名新兵组成的6个方阵，顶风冒雨、士气高昂、步履坚定，依次走过主席台接受检阅。分列式结束后，各方队立即转入实战化训练科目演示。泥泞的训练场，让官兵找到了“打仗”的感觉。战术基础、轻武器射击、格斗、棍术、反恐防暴等课目全面铺开……现场硝烟弥漫，爆炸声此起彼伏，冲锋号一响，训练有素的战士们勇往直前，他们熟练使用手中的武器，一招一式尽显新战士勇猛无畏、敢打必胜的战斗作风。训练场上没有往日的尘土飞扬，雨水、汗水、泥巴扑向了正在奋战的勇士，挂满了脸庞、衣服和战靴。笔者了解到，战略支援某部新兵团在雨中接受检阅，虽然是意外因素，但也真实检验了官兵在特殊气候条件下的战斗意识和战斗作风，培养新战士连续作战，顽强拼搏，敢打必胜的血性胆气。只有刻苦磨砺，才能百炼成钢；只有经历风雨，才能顶天立地。前进的号角已吹响，希望新战友们能够用刻苦训练的实际行动演绎精彩军旅生涯，用建功立业的铿锵步伐彰显军人价值，书写人生华章！(李晓威、十三、李文磊)
146,向党深情告白 这里的官兵同党旗合影,一面旗帜映初心，一颗红心永向党。,https://military.cctv.com/2021/06/25/ARTIuPICIfdVybiw7bGeQFk5210625.shtml,https://p1.img.cctvpic.com/photoworkspace/2021/06/25/2021062516174915448.jpg,一面旗帜映初心，一颗红心永向党。近日，武警广西总队桂林支队组织开展“我与党旗合个影”活动，官兵们通过多视角、多层次的“创意”定格，感悟初心使命、坚定奋斗决心，庆祝建党100周年。“我志愿加入中国共产党，拥护党的纲领……”中队党员们高举右手，重温入党誓词。鲜红的党旗熠熠生辉，激昂的誓言、铿锵的呼声，使全体党员从心灵上得到了一次新的洗礼。胸怀千秋伟业，恰是百年风华。官兵们在党旗的见证下，亮身份、晒党龄、谈感悟、作承诺，勉励自己坚定信念、永葆初心。该支队执勤二中队指导员黄思铭表示，以芳华立誓，用青春践言，在党旗的引领下，我们更要不忘初心，牢记使命。与党旗同框，让预备党员孔明激动的心情溢于言表，投笔从戎的他，选择从军报国，一踏入军营便下定决心扎根部队。他说：“很庆幸自己的青春有穿军装的样子，所有付出都是值得的。”挥动党旗，赤诚永固。活动结束前，上等兵郑世彬说道：“在与党旗合影的那一刻，强烈的使命感油然而生。我要坚定信念、勤学苦练，争取早日入党！”(陈登科、张宸硕)
147,广西南宁：武警官兵走进革命纪念馆 追思历史缅怀革命先烈,每到一个展厅，官兵们都认真观看、细细品味，零距离接受了一次生动的党史教育课，思想和灵魂受到了深刻的洗礼。,https://military.cctv.com/2021/06/25/ARTIESj6GAZaV61N477MJZLr210625.shtml,https://p5.img.cctvpic.com/photoworkspace/2021/06/25/2021062516044848525.jpg,为进一步推动党史学习教育走深走实，近日，武警广西总队南宁支队组织官兵来到广西革命纪念馆开展主题党日活动，通过向革命烈士敬献花篮、重温入党誓词、参观革命纪念馆等方式，让官兵在寻根溯源中重温峥嵘岁月、感悟初心使命。上午9时，广西革命纪念馆纪念碑前庄严肃穆，官兵在烈士公墓前整齐列队。随着雄壮的国歌声响起，活动正式拉开序幕，全体官兵鞠躬默哀，深情缅怀革命英烈。随后，伴随着深情庄严的《献花曲》，4名礼兵迈着庄重的礼步，托起书写“烈士永垂不朽”字样的花篮，缓缓走向烈士墓碑，庄严地向英烈敬献花篮。“我志愿加入中国共产党，拥护党的纲领，遵守党的章程，履行党员义务，执行党的决定……”面对鲜红的党旗，全体官兵高举右拳，重温入党誓词。仪式结束后，全体官兵在解说员的带领下步入广西革命纪念馆参观。每到一个展厅，官兵们都认真观看、细细品味，零距离接受了一次生动的党史教育课，思想和灵魂受到了深刻的洗礼。官兵们表示：一定不忘初心、牢记使命，以更好的精神状态、更饱满的工作热情，庆祝建党百年。(栾鑫磊、李启鹏、余海洋)
148,硝烟战场上的“特殊”震撼：直击手榴弹实投,新战友完成了军旅生涯的第一次手榴弹实投!,https://military.cctv.com/2021/06/25/ARTI6DvCEPrfxlgkWOgbCjkM210625.shtml,https://p2.img.cctvpic.com/photoworkspace/2021/06/25/2021062515460728261.jpg,近日，战略支援某部新兵团严格贯彻落实《军事训练大纲》要求，组织新兵进行手榴弹实投，锤炼官兵实战打赢本领。为给第一次投弹的新兵做好表率，营连主官带头投掷第一弹，随着手榴弹的爆炸，也给场下待投的新战友们，注射了一支“强心剂”。“报告，手榴弹投掷前准备完毕!”“投！”安全员一声令下，投弹人员迅速撤步引弹、挥臂，隐蔽防护，动作连贯一气呵成。“轰”一声巨响，落弹区内硝烟弥漫，爆炸声不绝于耳，一阵阵响声震的地动山摇。新战友完成了军旅生涯的第一次手榴弹实投!身穿“三级甲”，头戴“二级头”，新兵整装待发，目光坚毅、信心十足，在集合区等待着这人生中与众不同的第一次。待投区，教练员再一次，给新兵讲解投掷的注意事项，强调动作要领，并针对性地为其开展心理疏导。为确保手榴弹实投顺利进行，该新兵团通过组织示范观摩、视频教学、模拟弹投掷考核等活动，开展针对性训练，使新兵熟悉实弹投掷流程。同时，新兵团成立指挥领导小组，负责工作筹划、方案计划拟制、弹药保障、场地设置，医疗保障。实投过程中，严格按照“七区三所”规范设置场地，安全员全程陪同，确保实投安全顺利。（李晓威、十三、李文磊、周长瑞）
149,军民谐奏动人乐章,用艺术的力量感染观众，将红色基因注入血脉。,https://military.cctv.com/2021/06/24/ARTIbk3615ZxqF5ZKkSOmmmk210624.shtml,https://p2.img.cctvpic.com/photoworkspace/2021/06/24/2021062421535019922.jpg,满怀豪情迎党庆，军民同台奏华章。近日，国家大剧院合唱团走进武警北京总队执勤第六支队，进行“深入基层扎根人民”为主题的慰问演出，把精心编排的节目呈现给全体官兵，用艺术独有的魅力感染和熏陶官兵，并和刚刚走下执勤哨位的战士们一同唱响《没有共产党就没有新中国》，以此庆祝建党百年。“唱支山歌给党听，我把党来比母亲。”演出在混声合唱《唱支山歌给党听》中拉开帷幕，随着灯光渐起，座无虚席的礼堂瞬间沉寂，国家大剧院合唱团以专业的艺术水准再次唱响了这首沉淀着历史、凝聚着党恩的经典旋律。接下来是《草原上升起不落的太阳》《我爱祖国的蓝天》等混声合唱，艺术家们以悠扬的歌声、饱满的感情，唱响了人民群众对党的感激之情和强烈的爱国情怀。女声合唱《我爱你中国》、男声合唱《神圣的土地谁敢来侵犯》、混声合唱《不忘初心》《我和我的祖国》等等，慷慨激昂的旋律催生着官兵们的战斗激情，优美真挚的曲调抚慰着大家内心里最柔软的角落。艺术家们合奏的音乐会使人奋进，沁人心脾，一曲一调带动着大家的情绪，使官兵们在激昂的音乐中回望党史，在动人的旋律里铭记初心，共同感受过去与现在的光辉岁月。“真正的艺术并非曲高和寡，而是不论个人修养、文化底蕴、知识层面不同，却都能受到触动、升华心灵，与之形成共鸣，达成共识。”该支队政治工作部杨光主任讲到。据了解，今年国家大剧院开展的“百场公益演出”重点围绕党史学习教育策划了相关主题演出，立足将表演艺术与党史学习教育有机结合，用艺术的力量感染观众，将红色基因注入血脉。战歌高唱擎大纛，角鼓铮鸣催急行。演出期间，由支队71名基层战士组成的“人民军队合唱团”也登上舞台，为现场观众带来了《人民军队忠于党》和《当那一天来临》两首歌曲。他们走下哨位岗台，踏上演出舞台，用军人锤炼出的气势如虹唱响首都维稳精锐之师的铿锵步履，用充斥胸腔里的豪情激荡抒发人民战士忠于党的铮铮誓言，以基层战士最朴实的情感迸发出激越雄浑的澎湃张力。该支队刘少飞政委介绍说，支队也非常重视文化艺术氛围的营造，大力开展“强军风采”群众性文化活动，在举国同庆建党百年之际，又专门组建了战士合唱队，唱响革命歌曲感染和强化部队官兵爱党爱国情怀。战士们走上战位，他们肩负着守卫京畿大西南的职责重任，在平凡的岗位上践行忠诚；走下岗台，他们用战士的歌声来谱写忠诚，唱响一支支首都维稳精锐之师的强军战歌。支队紧密结合党史学习教育活动，力求在内容和形式上接地气、有特色、呈亮点，努力推动教育成果向战斗力转化，感染和熏陶官兵立足本职，踏实工作，以优异的成绩庆祝建党百年！（陈佩赵明杨昊）
150,今年27所军队院校计划招收普通高中毕业生1.3万余人,6月24日下午，国防部举行例行记者会，国防部新闻局副局长、国防部新闻发言人任国强大校答记者问。任国强介绍，根据今年军队院校招生计划，共有27所院校招收普通高中毕业生1.3万余人。,https://military.cctv.com/2021/06/24/ARTIdH7BQGkKssUdp5wyc9r5210624.shtml,https://p3.img.cctvpic.com/photoworkspace/2021/06/24/2021062416320883649.jpg,中新网6月24日电6月24日下午，国防部举行例行记者会，国防部新闻局副局长、国防部新闻发言人任国强大校答记者问。任国强介绍，根据今年军队院校招生计划，共有27所院校招收普通高中毕业生1.3万余人，其中军委直属院校1所、陆军10所、海军5所、空军4所、火箭军1所、战略支援部队2所、武警部队4所。记者：本月，全国高考顺利举行。广大考生和家长对2021年军校招生情况非常关注。请介绍全军院校招生工作安排。任国强：根据今年军队院校招生计划，共有27所院校招收普通高中毕业生1.3万余人，其中军委直属院校1所、陆军10所、海军5所、空军4所、火箭军1所、战略支援部队2所、武警部队4所。值得关注的是，招收普通高中毕业生标准条件有新的变化，今年起，全军院校招生(含武警)均应达到各省本科一批录取最低控制线，考生在高中阶段体质测试成绩应达及格以上。招收士兵学员的主要变化是，考学对象历年年度考核结果应当达到称职以上等次、历年个人年度军事训练成绩应当达到良好以上。在战区级以上单位认定的重大军事行动中获得表彰奖励、参加一线抗疫、执行维和以及护航等任务的考生享受相应加分和年限放宽政策。需要强调的是，军队院校招生遵循公开、公平、公正的原则，我们通过“军校招生”微信公众号及时发布相关信息，主动接受考生、家长及社会各方面的监督。人才自古要养成，放使干霄战风雨。在百年党史中，军队里始终活跃着怀抱崇高理想、充满奋斗精神的青年人。我们欢迎广大考生携笔从戎、报考军校，让青春在为祖国、为民族、为人民、为人类的不懈奋斗中绽放绚丽之花。
151,党史学习教育 这个飞行团有妙招！,增强开拓前进的勇气和力量，在党史的光辉航迹中贡献属于舰载人的时代印记。,https://military.cctv.com/2021/06/24/ARTIJ0xhgXb3pyIeYQIMm6BB210624.shtml,https://p1.img.cctvpic.com/photoworkspace/2021/06/24/2021062413110885378.jpg,回首建党百年路，不负舰载新征程。自党史学习教育活动开展以来，海军航空大学某训练团多措并举，教育引导全体官兵从党的百年伟大奋斗历程中汲取前进的智慧和力量，肩负起以舰载战斗机飞行人才培养为中心的使命任务，以优异成绩庆祝建党100周年！自党史学习教育活动开展以来，该团党委将开展党史学习教育作为一项重大政治任务，及时召开团党史学习教育动员大会。各单位积极响应，第一时间进行动员，教育引导官兵提升政治站位、深化思想认识。把理论学习贯穿始终，坚持以上率下，通过干部骨干带头学、官兵主动自学等多种形式，不断筑牢思想之基。并结合有效履行使命任务与单位实际，谈收获谈体会谈感悟，进一步坚定官兵投身舰载事业的决心意志。积极组织授课宣传，充分发挥课堂教育主渠道作用，探索形成“领导讲大课-基层讲小课-官兵讲微课-网络学党课”的授课机制，强化官兵学党史、悟思想、办实事、开新局的政治自觉，确保党史学习教育取得实效。发挥强军文化育人功能，通过组织演讲比赛和党史知识竞赛、重温入党誓词、参观红色教育场馆等活动，让官兵近距离接触历史，感悟先辈崇高精神。各级党组织围绕“七一”建党100周年这个中心，召开专题组织生活会、办好主题党日及相关活动，通过谈体会、亮思想、摆问题，进一步锻造坚强党性、强化信仰担当。“度之往事，验之来事，参之平素，可则决之。”开展党史学习，旨在使官兵从党的光辉奋斗历程中总结经验、把握规律，增强开拓前进的勇气和力量，在党史的光辉航迹中贡献属于舰载人的时代印记。(黄欢欢倪帅朱鑫亮周峰周琛生杨腾李冠霖王秋然侯超乔勇) 
